{
  "registry_id": "core-default-provider-registry-PLACEHOLDER",
  "version": "v1",
  "updated_at": "2026-05-02T20:00:00Z",
  "scope": "core_default",
  "providers": [
    {
      "provider_id": "openaq_v3",
      "label": "OpenAQ (CPCB-like) station-hourly air quality observations",
      "domain_ids": ["air_quality"],
      "provider_contract": "provider_air_quality_observation_feed",
      "connector_module": "urban_platform.connectors.air_quality.openaq.fetch_openaq_observations",
      "input_method": "api",
      "output_platform_object_types": ["Observation"],
      "examples": [],
      "provenance_behavior": { "strategy": "normalized", "notes": "Attach source_metadata; mark synthetic fallback when applicable." },
      "quality_flags": ["raw_provider_flag", "synthetic_fallback", "interpolated"],
      "conformance_requirements": ["schema_valid", "manifest_registered", "example_valid", "connector_tests"],
      "enabled_by_default": true,
      "status": "reference"
    },
    {
      "provider_id": "open_meteo",
      "label": "Open-Meteo weather observations (best-effort)",
      "domain_ids": ["air_quality"],
      "provider_contract": "provider_weather_observation_feed",
      "connector_module": "urban_platform.connectors.weather.open_meteo.fetch_open_meteo_observations",
      "input_method": "api",
      "output_platform_object_types": ["Observation"],
      "examples": [],
      "provenance_behavior": { "strategy": "normalized" },
      "quality_flags": ["raw_provider_flag", "synthetic_fallback"],
      "conformance_requirements": ["schema_valid", "manifest_registered", "example_valid"],
      "enabled_by_default": true,
      "status": "reference"
    },
    {
      "provider_id": "osm_extract",
      "label": "OpenStreetMap static features (roads/buildings/land use proxies)",
      "domain_ids": ["air_quality", "property_buildings"],
      "provider_contract": "provider_road_network_feed",
      "connector_module": "urban_platform.connectors.geospatial.osm",
      "input_method": "api",
      "output_platform_object_types": ["Feature"],
      "examples": [],
      "provenance_behavior": { "strategy": "derived_transform", "notes": "Derived features are computed from OSM extract; treat as proxy evidence." },
      "quality_flags": ["license_verified", "proxy_feature"],
      "conformance_requirements": ["schema_valid", "manifest_registered"],
      "enabled_by_default": true,
      "status": "reference"
    },
    {
      "provider_id": "flood_rainfall_file_fixture",
      "label": "Flood rainfall fixture/file ingest (for demos and tests)",
      "domain_ids": ["flood_risk"],
      "provider_contract": "provider_rainfall_observation_feed",
      "connector_module": "urban_platform.connectors.flood.ingest_file",
      "input_method": "file",
      "output_platform_object_types": ["Observation"],
      "examples": ["examples/flood/rainfall_observation.sample.json"],
      "provenance_behavior": { "strategy": "pass_through" },
      "quality_flags": ["fixture"],
      "conformance_requirements": ["schema_valid", "manifest_registered", "example_valid", "connector_tests"],
      "enabled_by_default": false,
      "status": "reference"
    },
    {
      "provider_id": "open_building_footprints",
      "label": "Open building footprints (licensed/open dataset)",
      "domain_ids": ["property_buildings"],
      "provider_contract": "provider_building_footprint_feed",
      "connector_module": "urban_platform.connectors.geospatial.buildings_osm",
      "input_method": "file",
      "output_platform_object_types": ["Feature"],
      "examples": ["examples/property_buildings/building_footprint.sample.json"],
      "provenance_behavior": { "strategy": "pass_through" },
      "quality_flags": ["open_data"],
      "conformance_requirements": ["schema_valid", "manifest_registered", "example_valid"],
      "enabled_by_default": false,
      "status": "reference"
    },
    {
      "provider_id": "satellite_change_signal",
      "label": "Satellite change/anomaly signals (built-environment triage; not permit detection)",
      "domain_ids": ["property_buildings"],
      "provider_contract": "provider_satellite_change_signal_feed",
      "connector_module": "urban_platform.connectors.satellite",
      "input_method": "file",
      "output_platform_object_types": ["Event"],
      "examples": ["examples/property_buildings/satellite_change_signal.sample.json"],
      "provenance_behavior": { "strategy": "pass_through" },
      "quality_flags": ["open_data", "review_required"],
      "conformance_requirements": ["schema_valid", "manifest_registered", "example_valid"],
      "enabled_by_default": false,
      "status": "experimental"
    }
  ]
}

